<?xml version="1.0" encoding="UTF-8"?>
<beans xmlns="http://code.google.com/p/firefly/beans"
       xmlns:xsi="http://www.w3.org/2001/XMLSchema-instance"
       xsi:schemaLocation="http://code.google.com/p/firefly/beans http://firefly.googlecode.com/files/beans.xsd">

    <component-scan base-package="com.firefly"/>
    <mvc view-path="/template" view-encoding="UTF-8"/>

    <import resource="custom-beans.xml"/>

    <!--通过添加com.firefly.server.http.Config的bean来配置HTTP Server-->
    <bean class="com.firefly.server.http.Config">
        <property name="serverHome" value="D:/java_prj/my_project/firefly-demo/web"></property>
        <property name="host" value="localhost"></property>
        <property name="port" value="7676"></property>
        <property name="keepAlive" value="false"></property>
    </bean>




</beans>
